{
  "$schema": "https://tcgsetdesigner.com/schemas/visual-template-v2.schema.json",
  "schemaVersion": 2,
  "internalName": "example-template",
  "version": "2.0.0",
  "website": "https://tcgsetdesigner.com/",
  "repository": "https://github.com/BigfootDS/template-tcgsd-visual-card-base",
  "templateAuthor": {
    "name": [
      {
        "language": "en",
        "content": "Alex Stormwood"
      }
    ],
    "url": "https://alexstormwood.com/",
    "email": "alex@bigfootds.com"
  },
  "name": [
    {
      "language": "en",
      "content": "TCGSD Example Visual Card Template"
    },
    {
      "language": "ja",
      "content": "TCGSD ビジュアルカードテンプレートの例"
    },
    {
      "language": "fr",
      "content": "Exemple de Modèle de Carte Visuelle TCGSD"
    }
  ],
  "game": {
    "internalName": "generic"
  },
  "defaultLayout": "reference",
  "layouts": [
    {
      "id": "reference",
      "name": [
        {
          "language": "en",
          "content": "Reference sheet"
        }
      ],
      "entry": "index.html",
      "profileSchemaVersions": [
        1,
        2
      ]
    },
    {
      "id": "compact",
      "name": [
        {
          "language": "en",
          "content": "Compact card"
        }
      ],
      "entry": "compact/index.html",
      "profileSchemaVersions": [
        1,
        2
      ]
    }
  ]
}
